{
  "ProjectName": "",
  "Description": "",
  "Version": "",
  "Preamble": [
    "Set-StrictMode -Version Latest",
    "$ErrorActionPreference = 'Stop'"
  ],
  "Manifest": {
    "Author": "",
    "PowerShellHostVersion": "",
    "GUID": "",
    "Tags": [],
    "ProjectUri": ""
  },
  "Package": {
    "Types": [
      "NuGet"
    ],
    "OutputDirectory": {
      "Path": "artifacts/packages",
      "Clean": true
    }
  },
  "Pester": {
    "TestResult": {
      "Enabled": true,
      "OutputFormat": "NUnitXml"
    },
    "Output": {
      "Verbosity": "Detailed"
    }
  }
}
